{
  "$schema": "https://json-schema.org/draft/2020-12/schema",
  "$id": "https://influencer-os.local/schemas/applied-social-template.schema.json",
  "title": "AppliedSocialTemplate",
  "type": "object",
  "additionalProperties": false,
  "required": [
    "applied_social_template_id",
    "idea_promotion_id",
    "social_template_id",
    "target_format_id",
    "application_rationale",
    "applied_beats"
  ],
  "properties": {
    "applied_social_template_id": {
      "type": "string",
      "pattern": "^applied_template_[a-zA-Z0-9_-]+$"
    },
    "social_template_id": {
      "type": "string",
      "pattern": "^template_[a-zA-Z0-9_-]+$"
    },
    "target_format_id": {
      "type": "string",
      "enum": [
        "format_short_form_video",
        "format_carousel",
        "format_single_image_post",
        "format_story_sequence"
      ]
    },
    "application_rationale": {
      "type": "string",
      "minLength": 1
    },
    "applied_beats": {
      "type": "array",
      "minItems": 2,
      "items": {
        "type": "object",
        "additionalProperties": false,
        "required": [
          "beat_label",
          "idea_application",
          "viewer_question_answered"
        ],
        "properties": {
          "beat_label": {
            "type": "string",
            "minLength": 1
          },
          "idea_application": {
            "type": "string",
            "minLength": 1
          },
          "viewer_question_answered": {
            "type": "string",
            "minLength": 1
          }
        }
      }
    },
    "idea_promotion_id": {
      "type": "string",
      "pattern": "^idea_promotion_[a-zA-Z0-9_-]+$"
    }
  }
}
